{
  "chunk_duration_s": 1.0,
  "device_requested": "cpu",
  "device_used": "cpu",
  "error_message": null,
  "error_stage": null,
  "input": "fixtures/audio/demo_mix.mp3",
  "live_artifact_path": "artifacts/bench/s06-capstone-mlCmoG/throughput/live_runtime_result.json",
  "live_cli_exit_code": 0,
  "live_runtime_error_message": null,
  "live_runtime_error_stage": null,
  "live_runtime_status": "ok",
  "metadata": {
    "clock_source": "perf_counter",
    "device_requested": "cpu",
    "device_used": "cpu",
    "live_command": [
      "/usr/bin/python3",
      "/mnt/c/Users/Danny/Documents/GitHub/CS4220-Capstone-Audio-Source-Separation/scripts/live/run_live_separation.py",
      "--source-mode",
      "mp3",
      "--output-dir",
      "artifacts/bench/s06-capstone-mlCmoG/throughput",
      "--artifact-path",
      "artifacts/bench/s06-capstone-mlCmoG/throughput/live_runtime_result.json",
      "--chunk-duration-s",
      "1.0",
      "--sample-rate-hz",
      "22050",
      "--max-queue-depth",
      "64",
      "--decode-timeout-s",
      "30.0",
      "--device-requested",
      "cpu",
      "--device-used",
      "cpu",
      "--mode",
      "smoke",
      "--model-path",
      "artifacts/models/umx-live.pt",
      "--input",
      "fixtures/audio/demo_mix.mp3"
    ],
    "live_timeout_s": 120.0,
    "max_wall_clock_ms": null,
    "source_mode": "mp3"
  },
  "output_dir": "artifacts/bench/s06-capstone-mlCmoG/throughput",
  "phase": "complete",
  "source_mode": "mp3",
  "status": "ok",
  "stderr": "",
  "throughput_chunks_per_second": 0.844568,
  "timestamp": "2026-04-20T22:31:59.797302+00:00",
  "wall_clock_ms": 1184.037877,
  "wall_clock_ms_per_chunk": 1184.037877
}
